{
  "schema_version": "2.0.0",
  "tipo_producao": "Monografias de cursos de aperfeiçoamento:especialização",
  "source_file": "Monografias de cursos de aperfeiçoamento:especialização.html",
  "extraction_timestamp": "2026-01-26T16:56:13.647457Z",
  "items": [
    {
      "numero_item": 1,
      "raw": "FRACETO, L. F. . Participação em banca de Gustavo Chriguer Telles. Levantamento de um efluente funerário - médico legal. 2009. Monografia (Aperfeiçoamento/Especialização em Meio ambiente e desenvolvimento sustentável) - Universidade Estadual Paulista Júlio de Mesquita Filho.",
      "autores": "FRACETO, L. F.",
      "titulo": "Participação em banca de Gustavo Chriguer Telles",
      "ano": 2009,
      "mes": null,
      "doi": null,
      "fingerprint_sha1": "4d8db3c4dcd73debbc4cf9af62260f167a04ba3f",
      "html_snippet": "<div class=\"layout-cell layout-cell-11\"><span class=\"transform\"><b>FRACETO, L. F.</b>.  Participação em banca de Gustavo Chriguer Telles. Levantamento de um efluente funerário - médico legal. 2009. Monografia (Aperfeiçoamento/Especialização em Meio ambiente e desenvolvimento sustentável)  - Universidade Estadual Paulista Júlio de Mesquita Filho. </span></div>"
    },
    {
      "numero_item": 2,
      "raw": "FRACETO, L. F. . Participação em banca de Fabiola Corradini Proença. Diagnostico e avaliação de uma população frente ao sistema de coleta seletiva empregado: o caso da Cooperativa Reviver em Sorocaba - SP. 2009. Monografia (Aperfeiçoamento/Especialização em Meio ambiente e desenvolvimento sustentável) - Universidade Estadual Paulista Júlio de Mesquita Filho.",
      "autores": "FRACETO, L. F.",
      "titulo": "Participação em banca de Fabiola Corradini Proença",
      "ano": 2009,
      "mes": null,
      "doi": null,
      "fingerprint_sha1": "5d66a89208de2115fccc77005191b3c3b84b12de",
      "html_snippet": "<div class=\"layout-cell layout-cell-11\"><span class=\"transform\"><b>FRACETO, L. F.</b>.  Participação em banca de Fabiola Corradini Proença. Diagnostico e avaliação de uma população frente ao sistema de coleta seletiva empregado: o caso da Cooperativa Reviver em Sorocaba - SP. 2009. Monografia (Aperfeiçoamento/Especialização em Meio ambiente e desenvolvimento sustentável)  - Universidade Estadual Paulista Júlio de Mesquita Filho. </span></div>"
    },
    {
      "numero_item": 3,
      "raw": "FRACETO, L. F. . Participação em banca de Elizandra Reginaldo Maruchi. Gestao de Residuos Solidos na industria farmaceutica de OTC \"Destinando e Gerando Receita\". 2009. Monografia (Aperfeiçoamento/Especialização em Meio ambiente e desenvolvimento sustentável) - Universidade Estadual Paulista Júlio de Mesquita Filho.",
      "autores": "FRACETO, L. F.",
      "titulo": "Participação em banca de Elizandra Reginaldo Maruchi",
      "ano": 2009,
      "mes": null,
      "doi": null,
      "fingerprint_sha1": "69572196d177055df80507f1f4e2edd66dcd693d",
      "html_snippet": "<div class=\"layout-cell layout-cell-11\"><span class=\"transform\"><b>FRACETO, L. F.</b>.  Participação em banca de Elizandra Reginaldo Maruchi. Gestao de Residuos Solidos na industria farmaceutica de OTC \"Destinando e Gerando Receita\". 2009. Monografia (Aperfeiçoamento/Especialização em Meio ambiente e desenvolvimento sustentável)  - Universidade Estadual Paulista Júlio de Mesquita Filho. </span></div>"
    },
    {
      "numero_item": 4,
      "raw": "FRACETO, L. F. . Participação em banca de Leandro Marcel de Souza. Avaliação do passivo ambiental por instituições financeiras em processos de financiamento. 2009. Monografia (Aperfeiçoamento/Especialização em Meio ambiente e desenvolvimento sustentável) - Universidade Estadual Paulista Júlio de Mesquita Filho.",
      "autores": "FRACETO, L. F.",
      "titulo": "Participação em banca de Leandro Marcel de Souza",
      "ano": 2009,
      "mes": null,
      "doi": null,
      "fingerprint_sha1": "a017753c8f320e414f66d3909d92c5d3e6c5c5d8",
      "html_snippet": "<div class=\"layout-cell layout-cell-11\"><span class=\"transform\"><b>FRACETO, L. F.</b>.  Participação em banca de Leandro Marcel de Souza. Avaliação do passivo ambiental por instituições financeiras em processos de financiamento. 2009. Monografia (Aperfeiçoamento/Especialização em Meio ambiente e desenvolvimento sustentável)  - Universidade Estadual Paulista Júlio de Mesquita Filho. </span></div>"
    },
    {
      "numero_item": 5,
      "raw": "FRACETO, L. F. . Participação em banca de Marcelo Mikyo Hori. Avaliação de soluções tecnologicas sustentáveis paa o setor da construção civil. 2009. Monografia (Aperfeiçoamento/Especialização em Meio ambiente e desenvolvimento sustentável) - Universidade Estadual Paulista Júlio de Mesquita Filho.",
      "autores": "FRACETO, L. F.",
      "titulo": "Participação em banca de Marcelo Mikyo Hori",
      "ano": 2009,
      "mes": null,
      "doi": null,
      "fingerprint_sha1": "b2d2954d08fd759ce9ba0ca875080e9cb23e14be",
      "html_snippet": "<div class=\"layout-cell layout-cell-11\"><span class=\"transform\"><b>FRACETO, L. F.</b>.  Participação em banca de Marcelo Mikyo Hori. Avaliação de soluções tecnologicas sustentáveis paa o setor da construção civil. 2009. Monografia (Aperfeiçoamento/Especialização em Meio ambiente e desenvolvimento sustentável)  - Universidade Estadual Paulista Júlio de Mesquita Filho. </span></div>"
    },
    {
      "numero_item": 6,
      "raw": "FRACETO, L. F. . Participação em banca de Suzan da Silva Lessa. Desperdiício de alimentos: um problema social e ambiental. 2009. Monografia (Aperfeiçoamento/Especialização em Meio ambiente e desenvolvimento sustentável) - Universidade Estadual Paulista Júlio de Mesquita Filho.",
      "autores": "FRACETO, L. F.",
      "titulo": "Participação em banca de Suzan da Silva Lessa",
      "ano": 2009,
      "mes": null,
      "doi": null,
      "fingerprint_sha1": "b3e62bb01bf57491207bb22147d073096c5665eb",
      "html_snippet": "<div class=\"layout-cell layout-cell-11\"><span class=\"transform\"><b>FRACETO, L. F.</b>.  Participação em banca de Suzan da Silva Lessa. Desperdiício de alimentos: um problema social e ambiental. 2009. Monografia (Aperfeiçoamento/Especialização em Meio ambiente e desenvolvimento sustentável)  - Universidade Estadual Paulista Júlio de Mesquita Filho. </span></div>"
    },
    {
      "numero_item": 7,
      "raw": "FRACETO, L. F. . Participação em banca de Adriana Kimie Kimura. Implantação do almoxarifado de produtos químicos e procedimentos labotatoriais, à favor do Meio Ambiente, Saude e Segurança dos trabalhadores e alunos da Unesp - Campus Experimental de Registro - SP. 2009. Monografia (Aperfeiçoamento/Especialização em Meio ambiente e desenvolvimento sustentável) - Universidade Estadual Paulista Júlio de Mesquita Filho.",
      "autores": "FRACETO, L. F.",
      "titulo": "Participação em banca de Adriana Kimie Kimura",
      "ano": 2009,
      "mes": null,
      "doi": null,
      "fingerprint_sha1": "707b2c2d72f30ae4556940a6f5798f0b51241f41",
      "html_snippet": "<div class=\"layout-cell layout-cell-11\"><span class=\"transform\"><b>FRACETO, L. F.</b>.  Participação em banca de Adriana Kimie Kimura. Implantação do almoxarifado de produtos químicos e procedimentos labotatoriais, à favor do Meio Ambiente, Saude e Segurança dos trabalhadores e alunos da Unesp - Campus Experimental de Registro - SP. 2009. Monografia (Aperfeiçoamento/Especialização em Meio ambiente e desenvolvimento sustentável)  - Universidade Estadual Paulista Júlio de Mesquita Filho. </span></"
    },
    {
      "numero_item": 8,
      "raw": "FRACETO, L. F. . Participação em banca de Alexandre José Flauzino. Gerenciamento de Residuos químicos no Ambiente Hospitalar. 2009. Monografia (Aperfeiçoamento/Especialização em Meio ambiente e desenvolvimento sustentável) - Universidade Estadual Paulista Júlio de Mesquita Filho.",
      "autores": "FRACETO, L. F.",
      "titulo": "Participação em banca de Alexandre José Flauzino",
      "ano": 2009,
      "mes": null,
      "doi": null,
      "fingerprint_sha1": "add77138c8a6db7de04ec84bb2c1f41ed444ae6c",
      "html_snippet": "<div class=\"layout-cell layout-cell-11\"><span class=\"transform\"><b>FRACETO, L. F.</b>.  Participação em banca de Alexandre José Flauzino. Gerenciamento de Residuos químicos no Ambiente Hospitalar. 2009. Monografia (Aperfeiçoamento/Especialização em Meio ambiente e desenvolvimento sustentável)  - Universidade Estadual Paulista Júlio de Mesquita Filho. </span></div>"
    },
    {
      "numero_item": 9,
      "raw": "FRACETO, L. F. . Participação em banca de Leandro Ramirez de Andrade. Problemas para implantar um sistema de gestão ambiental em obra de montagem eletrônica. 2009. Monografia (Aperfeiçoamento/Especialização em Meio ambiente e desenvolvimento sustentável) - Universidade Estadual Paulista Júlio de Mesquita Filho.",
      "autores": "FRACETO, L. F.",
      "titulo": "Participação em banca de Leandro Ramirez de Andrade",
      "ano": 2009,
      "mes": null,
      "doi": null,
      "fingerprint_sha1": "47c851d0b5c3d604d4125354e6abd1ec75947472",
      "html_snippet": "<div class=\"layout-cell layout-cell-11\"><span class=\"transform\"><b>FRACETO, L. F.</b>.  Participação em banca de Leandro Ramirez de Andrade. Problemas para implantar um sistema de gestão ambiental em obra de montagem eletrônica. 2009. Monografia (Aperfeiçoamento/Especialização em Meio ambiente e desenvolvimento sustentável)  - Universidade Estadual Paulista Júlio de Mesquita Filho. </span></div>"
    }
  ],
  "parse_metadata": {
    "parser_version": "1.0.0",
    "total_items": 9,
    "parse_errors": 0,
    "warnings": []
  }
}